courseCode,academicUnits,title,description
HW0218,2,Communication Across the Sciences,"The aim of the course is to enhance the abilities of science students to recognize and employ effective skills and strategies for written and oral communication in both academic and public settings. On the one hand, the emphasis of this course is on basic micro skills in scientific communication such as searching academic databases, critically reading scientific texts, citing from sources, composing scientific arguments, and making effective presentations. On the other hand, it introduces you to the conventions of scientific texts such as annotated bibliographies and proposals that require a combination of informative, evaluative, and persuasive writing skills. In addition, you will have an opportunity to share your ideas with your peers through group discussions, in-class presentations on current scientific topics and poster presentations of your proposals. Using a pre-determined set of evaluation criteria, you will give feedback to your peers on the course assignments, under the supervision of your tutors. The course will culminate with a poster presentation session where you will present your proposals to the wider scientific community in your schools for an authentic communication experience. Through this course, it is hoped that you will become better communicators when conveying your scientific ideas in writing and speech to your peers and an educated audience."
MH2100,4,Calculus III,"Calculus III is a core Mathematics course that extends concepts and techniques developed in Calculus I and Calculus II to the case of functions of several real variables. In other words, we try to do the same things as in Calculus I and II, but in higher dimensions. In this course, we shall discuss the notions of limits, continuity, derivatives and integrals of real-valued and vector-valued functions of many variables. Most of the time, extending these familiar notions from one to several variables requires some degree of ingenuity, and we are going to have to spice up the material from Calculus I and II with a little bit of geometry and linear algebra. Techniques learned in Calculus III are essential for financial analysts, engineers, and for further study in mathematics."
SD3920,10,Professional Internship (Graded),
SC1015,3,Introduction to Data Science & Artificial Intelligence,"This course will start with the core principles of Data Science, and will equip you with the basic tool and techniques of data handling, exploratory data analysis, data visualization, data-based inference, and data-focussed communication. The course will also introduce you to the fundamentals of Artificial Intelligence - state space representation, uninformed search, and reinforcement learning. The course will motivate you to work closely with data and make data-driven decisions in your field of study. The course will also touch upon ethical issues in Data Science and Artificial Intelligence, and motivate you to explore the cutting-edge applications related to Big Data, Neural Networks and Deep Learning. Python will be the language of choice to introduce hands-on computational techniques."
SC4025,3,Developing Data Products,"Data products are products whose principal thrust is to use data to facilitate certain end goals. These products may exhibit varied levels of complexity, spanning from being raw and derived data, intelligence and services derived from or driven by data, enabled by algorithmic and statistical tools such as machine learning. In many data products, the role of data can be subtle and the overall product may be composed of other modules, which could be more prominent in appearance. The scope of this course is confined to the exploration of the life-cycle of typical data products that deploy data-science dominantly or exclusively. We will deconstruct individual components across the full stack: ranging from data acquisition, wrangling and storage, testing, validation, and refinement - spanning exploratory analysis, issues of visualization and presentation, and application of machine learning techniques for decision support, anomaly detection and recommendation systems. We will explore this course with hands-on examples, illustrating how some data products utilize only a subset of these components, while others deploy the wider gamut. This course will also expose techniques to handle various kinds of data on their own and in conjunction, e.g., natural language data, datetime and timeseries, geoseries and graph data; the underlying systems and algorithms to support, analyze and learn using such data to build data products. Overall, in this course, we will describe several fundamental principles, and we will illustrate them in action using hands-on examples and tools. The choice of algorithms and software packages will be representative but not exhaustive. As such, the detailed description of course content uses 'e.g.,' to give possible indicative instances, but the actual delivery of the course may choose other tools, programming languages, frameworks and examples (including or excluding the indicative instances). Furthermore, the instantiation of tools and examples could vary over time, based on practical considerations, e.g., maturity and popularity of the tools among practitioners. The course will be delivered inter-mixing live lectures and hands-on exercises blended with some parts of the lectures offered in pre-recorded TEL format and curated reading materials."
MH3510,4,Regression Analysis,"This course aims to develop your understanding/grasping of the regression models of summarizing the relationship among variables. Linear regression models are widely used today in business, administration, economics, engineering, and the social, health and biological sciences. You should learn the rigorous way to approach regression models and be able to build regression models for real data."
MH3701,4,Basic Optimisation,"This is a first course in mathematical optimization. It builds the basic knowledge and skills in the theory and techniques of analysing and solving simple optimization models. With these foundations, you will be able to deepen your understanding of more complex optimization models, and their applications to various disciplines in subsequent mathematical optimization and operations research courses."
MH4500,4,Time Series Analysis,"This course provides an introduction to various time series models. It aims to develop your understanding of fundamental models in time series analysis and enable you to build time series models for read data.Introduction to time series models and their applications in economics, engineering and finance. Topics include: trend fitting, autoregressive and moving average models, spectral analysis; seasonality, forecasting and estimation; and the use of computer package to analyze real data sets."
MH4501,4,Multivariate Analysis,"This course focuses on the standard methods of multivariate statistical analysis. Many essential data analysis techniques, such as principal component analysis and discriminant analysis, will be covered. This course equips students with the necessary skills for being data analysts.Distribution theory: multivariate normal distribution, Hotelling's T2 and Wishart distributions; inference on the mean and covariance, principal components and canonical correlation; factor analysis, discrimination and classification."
MH4511,4,Sampling & Survey,"1. Probability Sampling a Types of Probability Samples b Simple Random Sampling c Estimation of Population Mean, Proportion and Total d Sample Size Estimation e Systematic Sampling 2. Stratified Sampling a Theory of Stratified Sampling b Sampling Weights c Estimation of Population Mean, Proportion and Total d Allocating Observations to Strata e Sample Size Estimation f Defining Strata g Post-stratification 3. Ratio and Regression Estimations a Ratio Estimation b Regression Estimation c Selecting the Sample Size d Relative Efficiency of Estimators 4. Cluster Sampling a One-Stage and Two-Stage Cluster Samplings b Estimation of Population Mean, Proportion and Total c Selecting the Sample Size d Cluster Sampling with Probability Proportional to Size 5. Sampling with Unequal Probabilities a One-Stage Sampling with Replacement b Two-Stage Sampling with Replacement c Unequal-Probability Sampling without Replacement 6. Nonresponse a Effects of Ignoring Nonresponse b Call backs and Two-Phase Sampling c Weighting Methods for Nonresponse d Imputation"
MH4513,4,Survival Analysis,"The course will introduce statistical methods used to analysis time-to-event data. Time-to-event or failure time data, and associated covariate data can be collected under a variety of sampling schemes and very commonly involves right censoring. The distribution of a time-to-event variable is often characterized in terms of its survival or hazard function. The course will cover fundamentals in survival analysis, with emphasis on statistical principal, methods and real life applications. The course will also motivate students to work closely with data and make inference nonparametrically and/or parametrically in the fields of study."
MH4515,4,Applied Bayesian Statistics,
MH4516,4,Applied Categorical Data Analysis,
MH4517,4,Data Applications in Natural Sciences,"This course aims to provide the recent progress on geometric data analysis, topological data analysis, the combination with machine learning models, and their applications in nature data analysis. In this course you will develop skills in geometric and topological modeling, and the analysis of complicated physical/chemical/biological data. Topological data analysis models, including simplicial complex, nerve theorem, homology, cohomology, filtration, persistent homology, Morse theory, Hodge-Laplacian, Reeb graph. Geometric data analysis models, including multidimensional scaling, isomap, diffusion map, spectral graph, manifold learning, differential forms. Geometry and topology based learning, including data representation, feature engineering, molecular/chemical descriptors, graph neural network."
MH4518,4,Simulation Techniques in Finance,"This course aims to equip you with standard and advanced simulation techniques and cover their applications in finance, including derivatives pricing and risk management. In this course, you will develop skills in modelling and simulating time series data, and based on which you will be able to devise solutions to quantitative finance problems. Generating random numbers and random variables, generating Brownian motion and other diffusion processes, variance reduction techniques, introduction to futures, options, and other derivatives, pricing exotic options with simulations, estimating sensitivities of derivatives with simulations, and applications in risk management"
CS4022,4,Social Media Mining,This course covers how to analyse unstructured data such as social media content using text mining techniques. Students will learn various text mining techniques and tools both through lectures and hands-on exercises in labs. The course will also explore various usages of text mining techniques to real world applications.
CS4031,4,Media Planning and Strategies,
AB1202,3,Statistics & Analysis,This course introduces the concepts and methods of statistical inferences: the process of inferring unknowns under uncertainty. Students of this course will also learn programming skills in the R environment for basic statistical analyses. This course consists of three main sections. Section 1 covers elements of probability models. Section 2 covers the basic theories in statistical inferences. Section 3 introduces the basic of two powerful and widely used analytic tools: regression and simulation analysis. Each weekly topic will be supplemented with relevant computer applications in the R environment.
AB1301,3,Business Law,"The aim of this course is to provide students with the foundational and intellectual skills to navigate the legal aspects of business. Specifically, this course provides a solid foundation on the legal methodology and the main principles of law relating to business transactions. A number of topics will be discussed in this course ranging from the formation of contracts, terms of a contract, breach and termination of a contract, law of agency, business organisations and torts. At the completion of this course, students will gain foundational competencies in how commercial law and business practices inter-relate and often influence each other in shaping modern commerce and industry. Key legal topics will be explained and illustrated from a business perspective. At the completion of this course, students will also gain a deeper understanding of the legal issues impacting on businesses
 "
AD1102,3,Financial Accounting,"This course aims to provide you with the necessary introductory accounting knowledge to understand how to use financial statement information to make economic decisions from a user perspective such as investors and creditors. In the process, you will learn to prepare a basic set of financial statements in accordance with the Singapore Financial Reporting Standards. The course also examines the impact of various accounting choices on the financial statements and the incentives that contracts based on accounting numbers can create for different stakeholders. This will help you understand why managers choose certain accounting methods and avoid others. This learning forms the foundation for further studies in areas which require accounting knowledge.
"
AB1601,3,Organisational Behaviour and Design,"Business is in the midst of a revolutionary transformation. Emerging technologies that combine AI, machine learning, cutting-edge visualization techniques, and social robots are fast revolutionizing the business workplace globally. Building a motived workforce is a critical responsibility of managers. To do so, managers must know why people behave in organizations the way they do. Research in cognitive sciences, artificial intelligence and neuroscience has generated significant insights that can enrich our knowledge of people. This course is designed to focus on processes and methods that can improve the attitudes and behaviors of organizational members. You will learn to know more about yourself and others. You will also learn how to influence and predict your own behaviours as well as those of others. Within the context of a world of social media, AI, and machine learning, you will learn various organizational behaviour theories and concepts, and then apply them appropriately to real-life situations to make sense of human behaviours and human-robots interactions at work. This course adopts a flipped classroom approach, which will give you ample opportunity to share your knowledge with others and also learn with them collaboratively."
AB1003,5,Professional Attachment,
AB0602,4,Communication Management Strategies (HW0288),"The purpose of this course is to prepare you for the communication challenges that you are likely to meet in rapidly evolving global business environments. It will help you to present yourself confidently, persuasively, and professionally in the way you speak, write and participate in your chosen profession. AB0602 starts with the basic - and well-rounded - premise that Communication Theory, Strategies and Skills are all needed in a highly complementary way for today's young executives preparing for workplace effectiveness. Theory provides a conceptual framework that guides strategy and skills. Strategy allows communicators to make intelligent choices about content, organisation, style, tone, delivery, and timing of messages. Skills are needed to craft effective written documents, give constructive feedback, and create as well as deliver persuasive business presentations. Throughout, the emphasis is on the art of persuasion for effectiveness in the corporate context. In addition, the course addresses other new demands in today's work culture. One such emerging demand is the need for effective Small Group Communication, a skill valued for collaborative work and team building. As such, you will be trained to go beyond prepared presentations to help you operate effectively in contexts which require spontaneous yet formal communication. Such contexts include small talk, meetings, team briefings and group discussions. Another new demand comes with the prevalence of online communication. To prepare for this trend, you will be guided to enhance your Executive Presence (EP) in both face-to-face and online settings, with special emphasis on social media and personal branding. Building on the theoretical foundation provided by EP experts, you will learn how to be an effective communicator across each medium - in-person, written or virtually - and in diverse situations. Finally, this course also offers you the opportunity to acquire an understanding of the method of Principled Negotiation developed by the Harvard Negotiation Project. You will gain hands-on experience in negotiation through engagement in negotiation simulations. To sum up, this course is planned to align with the broader vision of preparing you well for the workplace and address the increasingly complex needs of industry. As Mr. Ong Ye Kung, speaking as Acting Minister for Education (Higher Education and Skills), has noted: 'IHLs (institutes of higher learning) must help students to build up their essential soft skills, such as interpersonal skills, working in teams and across cultures, the ability to communicate well, negotiate effectively, and be resourceful and enterprising.' Approximating the real-world work environment and culture to the extent possible for a course, the teaching approach consistently keeps the final outcome in mind: 'your development as a work-ready young executive able to operate in the corporate context with presence and persuasion.'"
AB2008,1,Careers II,"This course will help you in your career development journey and prepares you for your future career. You will understand yourself better, realise your strengths and plan and map your career aspirations. Through this course, you will also have a broader understanding of the diverse industries, market requirements and current and future job trends. You will also learn how to stand out on LinkedIn, build your brand and be equipped with networking skills to engage employers and the business community for internships and job opportunities."
BC2402,4,Designing & Developing Database (SC2207),"This course introduces participants to design, tools, techniques, and issues concerning the management of data. Data management is the foundation for organizations' business analytics; and for problem solving and decision-making. Participants will analyse a variety of business process, identify data requirements and develop an information system to support business processes and gather information for business analytics. In this course, participants will have an opportunity to apply their design and development competencies by implementing a database solution."
BC2406,4,Analytics I: Visual and Predictive Analytics,"Most organizations are data rich and information poor. The large volumes of data in an organization are 'oilfields' rich in information content that are pending extraction with the right tools and models. Analytics involves the art of data exploration, visualization, communication and the science of analyzing large quantities of data in order to discover meaningful patterns and useful insights to support decision-making. The primary objective of this course is to introduce students to various techniques available to extract useful insights from the large volumes of data. At the end of the course, students will not only see the substantial opportunities that exist in real world, but also learn techniques that allow them to exploit these opportunities. This course focus on the use of open source R software, which is one of the key analytics software used in various industries and a critical skillset required in the job market for analytics and data science professionals."
AB1201,3,Financial Management,"This course aims to provide business and accounting students with a broad understanding of all the important financial principles, concepts, and analytical tools. This is a first course in finance and is compulsory for all business and accounting students. For students intending to major in banking and finance, this course is an important foundation course in order to better prepare themselves for other advanced courses such as Advanced Corporate Finance, Financial Markets and Institutions, International Financial Management, Investments, Equity Securities, Fixed Income Securities, and Derivatives Securities."
BC2407,4,Analytics II: Advanced Predictive Analytics,"Previously, BC2406 introduced core concepts of Business Analytics and the important models in used by businesses and governments. However, there are more complex situations that require more sophisticated Analytics solutions. BC2407 is the continuation of BC2406. The main objective of BC2407 is to introduce students to advanced Analytics techniques to extract more useful and deeper insights under more complex realistic situations. At the end of the course, students will see the strengths and weaknesses of standard models, and learn advanced techniques to overcome the weaknesses in various scenarios. This course builds upon open source R software (as learnt in BC2406), and introduced a commercial software SAS, commonly used in Banks, Pharmaceuticals, MNCs and some government agencies. Students will learn the differences between R and SAS in both the model development phrase and in the standard software outputs."
AB1501,3,Marketing,"This course aims to provide you with the opportunity to learn and the application of the basic principles of marketing in the Singapore market. A good understanding of marketing, by itself and in relation to other disciplines, is critical for anyone interested in developing successful and sustainable business enterprises. Hence, this course is a foundational course for marketing that is suitable for all students interested in business and accountancy. At the end of this course, you will be able to develop suitable customer-driven strategies to take advantage of potential market opportunities and manage the marketing process."
AD2102,3,Management Accounting,"This course covers the strategic nature and relevance of managerial accounting for today's competitive business environment. The course adopts a unique user-perspective and emphasis is placed on the development of problem-solving and decision-making skills. Hence the course focuses on the use of essential managerial accounting tools and techniques to provide managerial accounting information for planning and control and to support effective economic decisions. The course also exposes students to real-life scenarios and gives students an opportunity to integrate theories to business practice. The course aims to equip students with analytical skills for problem solving and managerial skills for decision making. After the completion of this course, students should be equipped with a strong conceptual and technical knowledge in managerial accounting. Students should understand and appreciate how managerial accounting information support organizational planning and control, and day-to-day decision making."
AB3602,3,Strategic Management,"The purpose of the Strategic Management Course is to develop students' knowledge and skills to identify and evaluate the sources of superior firm performance through applying selected conceptual frameworks. Students will learn to analyse the external and internal environments of the firm, and formulate strategies with the consideration of good corporate governance. This course is appropriate for accounting and business students who have already taken entry-level courses in accounting ratio analyses, organizational behaviour, and marketing. Upon completion of the course, students will be able to critically analyse business issues from a strategic perspective such as why and how firms can achieve sustainable competitive advantages in a highly volatile and competitive global business environment."
HE5091,3,Principles of Economics,"Introduction. Demand and supply. Marginal reasoning and profit maximuzation. Market structure. Externality. Introduction to Macroeconomics. Keynesian Cross Model. Money, banking and financial Institutions. Aggregate demand and aggregate supply. Open economy. International trade."
