courseCode,academicUnits,title,description
SC1003,3,Introduction to Computational Thinking and Programming,"Computational thinking (CT) is the process of analyzing a problem then designing and expressing its solution in such a way that a computer can effectively carry it out. This course aims to take students with no prior experience of thinking in a computational manner to a point where they can derive simple algorithms and code programs to solve basic problems in their domain of studies. Topics also include basic program constructs, simple data structures, and an appreciation of the internal operations of a processor."
SC1004,4,Linear Algebra For Computing,"This course aims to support you to learn mathematical concepts related to linear algebra and complex numbers. You will develop set of mathematical skills for applications in computer science and engineering, e.g., machine learning, computer graphics, data science etc."
SC1005,3,Digital Logic,"This course aims to develop your ability to analyse and design digital circuits. The design and behaviour of modern digital equipment (e.g. mobile phones and personal computers) are based on functions of binary variables. This course provides you the knowledge to analyse the theoretical characteristics and the skills required for practical technology driven implementations of digital circuits. This course provides an introductory perspective of digital circuits design. It is relevant for anyone pursuing a career in the ICT industry - including those in digital systems, computer architecture and microprocessor based systems design."
MH1812,3,Discrete Mathematics,"This course serves as an introduction to various topics in discrete mathematics. Familiarity with formal analysis through simple problems in some basic discrete structures is a key objective rather than knowing these structures in depth. Specifically, the main aim is to learn topics from the following broad areas of discrete mathematics: number theory, logic, combinatorics, and graph theory. This course aims to provide students with a solid mathematical foundation and is intended for first year computer science and computer engineering students."
CC0003,2,Ethics & Civics in a Multicultural World,"This course aims to equip students with the philosophical foundations necessary to understand theories of ethics and subsequently apply those theories to real-life scenarios and issues. It also aims to enable students to critically assess the civic institutions that structure their local and global communities. To these ends, the course will examine the nature of ethics, its understanding across different cultures, and how it is manifested in concepts, social structures, and governance institutions. Topics to be explored include human rights, democracy, freedom of speech, inequality, and sexuality. The rights and duties of citizenship shall be a unifying theme. Students will think through assumptions they hold on all of these matters. They will be provided with the tools to understand various and even contradictory perspectives on these important issues."
CC0005,3,Healthy Living & Wellbeing,"This course is part of the NTU 2025 Education - Common Foundational & Interdisciplinary Collaborative Curriculum (ICC). It aims to provide multi-disciplinary competence in a cross-disciplinary, collaborative learning environment, with student interaction and collaboration across schools as a key learning foundation. As the title connotes, the main objective of this undergraduate course is to examine what constitutes living a good, healthy and flourishing life. According to research, individuals around the world pursue this 'flourishing life' in different ways, be it through improving one's physical fitness, seeking authentic relationships with others, or making a positive change in the environment. Thus, knowing and understanding how the different components of a 'good life' contribute to one's overall functioning is critical to one's healthy wellbeing. The latter, in turn, affords many benefits such as better health (physical, mental and emotional health) and stronger relationships. By the end of this course, you would have developed an awareness of what constitutes living a healthy and flourishing life, both of which indirectly contribute to a successful undergraduate education.
 "
HW0001,0,Introduction to Academic Communication,"The course aims to support you in your academic writing and reading skills across a wide range of disciplines. This course will provide opportunities for you to read current event articles widely and critically. As a result, you will learn to evaluate opinions and formulate well-substantiated arguments."
SC1006,3,Computer Organisation & Architecture,Computer Hardware Decomposition; Solid-state memory subsystems; Magnetic memory; Input/Output techniques; The central processor unit; How high level code is `executed?; Quantifying and comparing performance; Computer arithmetic; Towards higher speed.
SC1007,3,Data Structures & Algorithm,"This course aims to (i) teach the concepts, implementations and applications of data structures such as arrays, linked lists, stacks, queues and trees that are important for building efficient algorithms; (ii) provide an introduction to algorithm analysis and design. These are essential for future computer science and computer engineering courses."
SC1008,3,C and C++ Programming,
SC2000,3,Probability & Statistics for Computing,"This course aims to develop your foundation in engineering mathematics, particularly in probability and statistics. This course provides the basic engineering mathematics foundation that is necessary for anyone pursuing a computer science and engineering degree course."
SC2002,3,Object Oriented Design & Programming,"The object-oriented paradigm to the design of software is one major successful approach to address complexity and maintainability issues in software systems. We want students to establish an object-oriented mindset and to gain valuable insights into how software can be developed using the object-oriented approach. This course should not be interpreted to be a pure programming language course. Rather, the programming language serves to illustrate, via practical examples, the concepts learnt in the course. As a student of this course, you will learn essential object-oriented concepts such as encapsulation, the separation of design from implementation, the use of inheritance and polymorphism. Finally, you will also learn good design principles for reuse, and to realise these principles using object-oriented programming languages such as Java and/or C++."
CC0001,2,Inquiry & Communication in an Interdisciplinary World,"Researchers agree that writing is a tool for thinking (Menary, 2007; Klein & Boscolo, 2016; Miller and Jurecic, 2016; Reis, n.d.). As Reis explains, 'The bodily act of writing externalizes our thoughts, and the imposed structure (the written word) provides a vehicle by which those thoughts may be reorganized into new thinking, a new way of seeing the thoughts or a new way of organizing thoughts.' Miller and Jurecic similarly argue that 'writers discover what they think not before they write but in the act of writing' (2016, p. 60). One of the main aims of this course is to allow you to experience writing as a tool for thinking and to practice expressing ideas in formal writing and oral communication. While you will have the opportunity to understand and practice the genre conventions that are specific to your discipline later in your studies, this first common communication course is designed to help you form habits of mind that will serve you across the university and even in the world outside of the university. Taken by all first-year undergraduates, this foundational course will develop your written and oral communication skills, as well as your ability to read and analyze texts. It will help you to understand revision as integral to the process of composition, to convey your interpretations and ideas with confidence and clarity, and to consider audience and purpose when you communicate."
CC0002,2,Navigating the Digital World,"With digitalization now becoming the new normal in our daily life, this course seeks to equip students from different disciplines with problem?solving techniques with the aid of computers and to enable them to acquire some common but essential digital skills that are crucial in today's workforce. In this course, students will learn how to apply the concept of computational thinking and quantitative reasoning to solve problems and analyze data. They will also learn how to identify online threats and understand the principles of ethics and intellectual property rights in the digital world. They will also be exposed to current issues in the digital world, which they can better understand through the logic of computational thinking and quantitative reasoning, such as cybersecurity and the rise of fake news. In addition, students will also learn how to use some of the latest online tools for effective presentation, communication, and collaborative skills in teams during the course."
SC2001,3,Algorithm Design & Analysis,"This course aims to develop your knowledge, understanding and skills about algorithm design and analysis. Upon the successful completion of this course, students shall be able to (i) apply additional analysis techniques in complexity analysis of recursive algorithms; (ii) apply, design and analyse algorithms using a number of approaches to solve various problems like sorting, shortest-path, minimum spanning tree, optimal sequencing for matrix multiplication, the longest common subsequence, string matching. Students will also learn the concepts of complexity classes P & NP and apply greedy heuristic approach to solve NP-complete problems."
SC2005,3,Operating Systems,"This course aims to develop your understanding of fundamental concepts and principles of modern operating systems, and to build your knowledge on the design and implementation of main operating system components."
SC2203,3,Automata. Computability and Complexity,
SC2006,3,Software Engineering,Introduction to Software Engineering; Software Engineering Process; Introduction to Requirements; Introduction to Software Specifications; Software Design and Construction; Testing and Integration; Software Maintenance; Software Project Management; Software Quality; Dependability and Security
SC2008,3,Computer Network,"This course serves as a foundation for computer and communication networks. Emphasis is placed on concepts, protocols and technologies, which formulate various Local Area Networks (LANs), Wide area Networks (WANs), and their interconnections. Emphasis is also placed on the fundamentals of the Internet, and includes laboratory sessions on socket programming. Advanced materials, such as, cloud computing, will also be covered to prepare you well for your future career."
CC0007,3,Science & Technology For Humanity,"The course aims to inspire a long-lasting mindset of awareness, critical thinking, curiosity, and collaboration across disciplines through the lens of contemporary and near-future challenges for human communities in relation to scientific and technological innovations. Students will learn to perceive and analyze the potential benefits and costs of scientific/technological innovations and applications from different perspectives and on different scales. Students will then use these skills to identify real-life challenges and to propose solutions."
SC2207,3,Introduction to Databases,Overview of Database Management Systems (DBMS); Entity-Relationship Data Model; Relational Data Model; Functional Dependencies (FD) and Normalization; Relational Algebra; Structured Query Language (SQL); Storage of Relational Data; Indexing Techniques; Query Processing and Optimization; Transaction Management and Concurrency Control
CC0006,3,"Sustainability: Society, Economy & Environment","Sustainability stresses the importance of future development to meet the needs of the present without compromising the ability of future generations to meet their needs. This concept is a culmination of economic, environmental, and social discourse throughout the last few decades. The United Nations (UN) declared a Decade of Education for Sustainable Development (DESD) with the aim to promote 'a more sustainable world through different forms of education, training and public awareness activities'. This provides an opportunity to reconsider approaches undertaken to address global challenges. It is imperative that pedagogical directions for higher education institutions address the foundations of sustainable development across different disciplines due to its complex and multi-faceted nature that encompasses a full spectrum of socio-economic-environmental issues. As such, this course aims to stimulate critical thinking, curiosity, and the ability to structure and synthesise knowledge through the lens of sustainability. Learning will be reinforced by concrete case studies with a focus on topics such as resource management, pollution, responsible consumption, and climate change. The course will require systematic analyses of major current sustainability challenges from the perspectives of society, economy, and the environment, and look at how we can promote a more sustainable world through choices and actions, as individuals, societies, nations, and as a global community. Through this learning process, students will acquire a systems thinking approach to sustainability that enhances knowledge and skills sets relevant to various disciplines and career paths. This course hopes to inspire and equip students to be agents of change toward a more sustainable world."
ML0004,2,Career & Innovative Enterprise for the Future World,"Having a creative and enterprising mindset can assist students in successfully manoeuvring through the VUCA world. It is crucial for students to nurture certain qualities associated with an enterprising mindset, including embracing uncertainty and change, honing critical thinking skills, and exhibiting a collaborative and adaptable nature. These qualities are vital in helping students to prepare for a rapidly evolving environment. The concept of ""designing your work life"" can be a valuable tool, inspiring students to explore their career options and possibilities by considering their values, interests, personality traits, and skills (VIPS) through prototype conversations. With more local employers emphasising skills-based hiring and retention, it is essential for students to continuously enhance their proficiency in relevant and sought-after skills to be well-prepared for the future of work."
SC2079,4,Multidisciplinary Design Project,"Seminars and Workshops - Throughout the MDP, students will be required to attend relevant seminars and workshops that would help them understand the process and tools for designing, developing and marketing of real-world multidisciplinary products. These include both general and technical seminars. General seminars may cover topics such as guided innovation, multidisciplinary problem solving, working effectively in engineering teams, understanding effective marketing strategies, project management, professional, ethical and moral responsibilities etc. Technical seminars and workshops will be related to specific engineering methodology and tools that can help students implement their respective ideas. These may include systems engineering and design, large-scale web systems, embedded systems development tools, etc. In their implementation, students will have to factor in appropriate considerations for public health and safety, cultural, societal factors, environmental and other constraints as well as the needs for sustainable development. Laboratories - Laboratory during MDP will be a mixed of guided and open accessed sessions. Teams - Students will be grouped into teams of about 6-7 member. The composition of these team members will consist of a multidisciplinary mix of CS, CE and BCG students. Supervision - Each team will be assigned a faculty mentor during the MDP."
HW0288,2,Engineering Communication,"HW0288 is an advanced course which aims to enhance the spoken and written abilities of engineering students when communicating in both academic and professional settings. In this course, the emphasis is on advanced skills in academic and professional communication. In the academic literacy and information literacy components of the course, you learn advanced skills for searching academic databases, evaluating sources and incorporating and citing them appropriately in your writing. In the professional communication component of the course, you learn written and oral workplace communication skills such as writing emails, participating at meetings, interacting with clients and projecting a professional image of yourself."
SC3079,10,Professional Internship,
SC4079,8,Final Year Project,
SC3000,3,Artificial Intelligence,"Computer / software engineers are involved in effective and efficient building of knowledge agent systems that satisfy the requirements of users; possibly software for intelligent embedded and intelligent information systems. General awareness of theory, knowledge, and practice in all phases of the knowledge based systems and representation techniques for problem solving are necessary for those of you who wants to get into the field artificial intelligence. These are advanced intelligent systems that are finding widespread applications in finance, banking, manufacturing industries."
SC4000,3,Machine Learning,This course introduces basic concepts and methodologies for machine learning as well as their applications. Clustering. Dimension Reduction. Classification. Decision Theory. Density Estimation. Classifier Evaluation.
SC4001 ,3,Neural Networks & Deep Learning,"This course aims to provide you with a basic but comprehensive foundation of neural networks and deep learning, including underlying principles, architectures, and learning algorithms of various types of deep neural networks that are essential for future applications of artificial intelligence and data science."
SC4002,3,Natural Language Processing,"This course introduces natural language processing at a basic level. 1. Basic concepts of syntax, semantics, and grammar formalisms 2. Basic techniques of language modelling, part-of-speech tagging, parsing, and semantic analysis 3. Well-known applications of natural language processing, such as machine translation and information extraction, and their evaluations"
SC4003,3,Intelligent Agents,
SC4061,3,Computer Vision,Image formation and segmentation. Image acquisition. Image representations and organisations. Digital image characterisation. Image enhancement and restoration. Image coding and data compression. Geometry for 3D vision. Pattern recognition using neural networks. Image analysis and understanding. Machine vision applications.
SC3010,3,Computer Security,"This course aims to equip you with foundational knowledge on many important security issues and techniques required for cyber security. You will have the knowledge of different security policies and security models, and have the ability to recognise security features and discover pitfalls in computing systems, including the operating system and software."
SC4010,3,Applied Cryptography,"Summary: Cryptography is the foundational building block of Cybersecurity and Privacy. While the field of classical cryptography dealt with security and privacy of data in transit, the modern take on the subject has generalized the scope of its applications to ensuring security and privacy of all forms of digital communication, computation, automation, interaction, transaction and preservation. Thus, it is important to understand the technical aspects of cryptography to appreciate its applications in cybersecurity. The Aim: This cryptography course in Computer Science and Engineering aims to develop your ability to understand how cryptographic algorithms work, to identify the problems associated with the application of cryptography in real-world scenarios, and explain the operation of various cryptographic mechanisms. This course will equip you to know deeply the fundamentals of symmetric key ciphers, hash functions and public key ciphers, enabling you to understand and develop secure cryptography solutions in real life cryptography. It will also introduce you to popular cryptographic libraries and APIs for hands-on implementation of security mechanisms, and some prominent cryptographic standards, guidelines and frameworks from the industry and government bodies."
SC4011,3,Security Management,"This course aims to develop your ability to identify the problems associated with (cyber and information) security management and understand using case studies that to effectively address them, one needs to design solutions that encompass multiple dimensions, including technology, people, processes and (internal as well as external) regulations. This course provides an introductory but broad perspective of cyber and information security, and is relevant for anyone pursuing a career in the IT/ICT industry ? including those in product design and development, security engineering, penetration testing, network/system administration, as well as, given the proliferation of IT in all walks of our lives, in executive roles across industries and government."
SC4012,3,Software Security,"This course aims to develop skills in software security. It focuses on security attacks launched by supplying specially crafted inputs to software components that modify the intended behaviours of those components, and the secure coding techniques (defences). The modified behaviours of the software components become security critical in a connected world where application systems are constructed from a collection of software components. Software developers who are not familiar with software security are likely to omit suitable defences out of ignorance. As such, this course will equip you with the deep knowledge about software security attack and defence techniques, a skill necessary to become IT security experts or professional software developers."
SC4013,3,Application Security,"Web applications have become the cornerstone of our digital lives, yet they also represent a critical vulnerability on the ever-expanding cyber battlefield. Malicious actors relentlessly probe these applications for weaknesses, aiming to steal sensitive data, disrupt operations, or compromise user privacy. In this dynamic landscape, security professionals with expertise in web application security are the cyber sentinels - the highly skilled defenders who identify, assess, and mitigate threats before they can exploit critical vulnerabilities. This intensive course is designed to equip students with the comprehensive knowledge and practical skills necessary to thrive in this in-demand field. Students will gain a deep understanding of web application security principles, master industry-standard testing methodologies, and develop the expertise to identify and exploit vulnerabilities in simulated environments. By the end, students will be well-prepared to launch a successful career as a web application security professional, playing a vital role in protecting our digital infrastructure."
SC4014,3,Concepts and Techniques for Malware Analysis,"Malware analysis is a specialization within cyber security. Malware attacks are often detrimental to companies or organizations. When malware breaches an organization's defences, the security team needs to act quickly to cure current infections and prevent it from re-occurring. Understanding the capabilities of the malware is critical to an organization's ability to quickly create a signature to prevent the widespread of the malware across the network, to block further communications from the attacker. This understanding could also be translated to valuable knowledge in identifying existing security gaps within an organization's system and fortify defences. This course aims to build a strong foundation to perform triage on malicious software using a variety of system and network monitoring utilities, a disassembler, a debugger and many other freely available tools."
