courseCode,academicUnits,title,description
SC4015,3,Cyber Physical System Security,"Cyber physical systems are typically designed as a network of interacting elements with physical input and output, and are characterized by the interaction between the physical world (sensors, user inputs, actuators) and the cyber world (processing, decision making). Cyber physical systems are the driving force behind modern civilization, being integral part of technologies, such as additive manufacturing, smartcard-based payment, power delivery systems, drone-based operations, and smart home automation. Cyber physical systems are characterized by stringent performance requirements, such as, extremely low energy budget, small area footprint and often hard real-time constraints. Due to the pervasive nature of the cyber physical systems in our everyday lives, it also runs the risk of huge security hazards. In this course, we will learn about the basics of cyber physical systems, including the design principles and methodologies. Further, there will be a detailed treatment of the security challenges for cyber physical systems, which vary in practice due to the diverse nature of the application environment of cyber physical systems. These different forms of security breaches, observed across diverse cyber physical systems, will be put in a well-characterized taxonomy, to be systematically identified as attack surfaces. The techniques to handle these attacks will be described in a generic manner, including key management and wireless/RFID communication. The attack surfaces and protection/mitigation principles will then be elaborated with practical case studies, from the representative cyber physical systems such as automotive, smart card systems and smart grid."
SC4016,3,Cyber Threat Intelligence,"This course aims to introduce Cyber Threat Intelligence as a concept and teach students the approach and different techniques for managing and processing Cyber Threat Intelligence ? from collections to prioritization of assets and to better leverage tactical, operational, and strategic-level threat intelligence as well as to better comprehend, synthesize, and leverage cyber threat intelligence to respond to different cyber situations."
SC3020,3,Database System Principles,"Database management systems (DBMS) are designed to manage large and complex data sets. The fundamentals of the implementation of database management systems must be understood by all Computer Science students. This will help students to develop and design software systems utilizing databases, and equip students with the knowledge of managing data of large scale. Moreover, this should be understood by current and future business leaders so that they can offer strategic guidance based on an informed understanding of database business capabilities. This course provides the basis for achieving this goal."
SC4020,3,Data Analytics and Mining,"We live in a world where we are surrounded by systems that are incredibly complex, from the society, a collection of billions individuals, to communications systems, integrating billions of devices, from computers to cell phones. In fact, the existence of living beings in this planet depends on the ability of thousands of proteins to work together in a seamless fashion. Furthermore, our ability to comprehend our surroundings is heavily influenced by the activity of billions of neurons in our brain. Such complex systems can be represented as static or dynamic networks of many interacting components. These components are typically much simpler in terms of behavior or function than the overall system, implying that the additional complexity of the latter is an emergent network property. Network science is a new discipline that investigates the topology and dynamics of such complex networks, aiming to better understand the behavior, function and properties of the underlying systems. In this course, we will study algorithmic, computational, and statistical methods of network science, as well as its applications in solving real-world problems in communications, biology, sociology, and cyber security. The specific topics include network metrics, properties, and models, network querying and analytics, network dynamics, and distributed graph engines. Another pervasive goal of this course is to guide students into the future by presenting research that reveals the ?next big thing? in network science."
SC4021,3,Information Retrieval,
SC4022,3,Network Science,"We live in a world where we are surrounded by systems that are incredibly complex, from the society, a collection of billions individuals, to communications systems, integrating billions of devices, from computers to cell phones. In fact, the existence of living beings in this planet depends on the ability of thousands of proteins to work together in a seamless fashion. Furthermore, our ability to comprehend our surroundings is heavily influenced by the activity of billions of neurons in our brain. Such complex systems can be represented as static or dynamic networks of many interacting components. These components are typically much simpler in terms of behavior or function than the overall system, implying that the additional complexity of the latter is an emergent network property. Network science is a new discipline that investigates the topology and dynamics of such complex networks, aiming to better understand the behavior, function and properties of the underlying systems. In this course, we will study algorithmic, computational, and statistical methods of network science, as well as its applications in solving real-world problems in communications, biology, sociology, and cyber security. The specific topics include network metrics, properties, and models, network querying and analytics, network dynamics, and distributed graph engines. Another pervasive goal of this course is to guide students into the future by presenting research that reveals the ?next big thing? in network science."
SC4023,3,Big Data Management,"We are in the 'Big Data' era - an extremely large amount of data is created every day. The world of data management has dramatically changed in the 'Big Data' era. This is primarily driven by multiple factors including cheaper storage costs, increasing availability of sensors, smart devices, social software, and availability of cloud computing infrastructure, and cheaper processing cost of large volumes of data due to dramatic advances in modern hardware (e.g., solid state disk, multicore CPUs, large memory). This seismic impact of big data has led to increasing demand in building scalable data infrastructures toward supporting real-world applications. This course aims to provide a broad understanding of big data and current technologies in managing and processing them. Key topics covered in this course include big data 5V's, memory hierarchy and its relation to big data systems, distributed storage and computation of big data, as well as NoSQL key-value stores. Upon completion of this course, you will learn to evaluate issues associated with big data management, learn how the data is stored in a distributed system and how queries and analytics run in parallel, and understand the design philosophy of real-world key-value stores."
SC4024,3,Data Visualisation,"The data visualisation course aims to provide computer science-oriented students with the principles and practice to design and present effective data visualisation solutions for different datasets and visualisation objectives. The course focuses on applying design considerations which take into account the human's visual and psychological characteristics, with the goal of designing effective and ethical visuals. The course also introduces students to the large variety of techniques and tools for visualising, exploring and interacting with both abstract and scientific data."
SC3030,3,Advanced Computer Networks,"Building upon earlier courses (SC2008), this subject aims to bring students into the realm of real inter-networking. The subject consists of two complementary components. On one hand, several application layer protocols are to be explained, along with their requirements on the underlying networks. One the other hand, practical network design and management methodologies will be introduced; they aim at meeting the application requirements. Emphasis is mostly placed on the practical use and construction of networks, with a bias toward multimedia applications. Advanced materials, such as, peer-to-peer networking will also be covered to prepare the students well for the future career in advanced computer networks."
SC3040,3,Advanced Software Engineering,"Building upon software engineering and design concepts covered in Software Engineering (SC2006), this course aims to introduce advanced software engineering management topics to you including Quality Management, Project Management, Configuration Management, and Maintenance, according to the Software Engineering Body of Knowledge."
SC3050,3,Advanced Computer Architecture,"Processor System Design: CPU interfaces, clock, control, data & address bus; System firmware. The CPU Architecture: including ISA, compiler relationship, control, pipelining, hazards, CISC/RISC/VLIW and issues of ILP. Memory Systems: cache, virtual memory systems and the MMU, access methods, reliability, error detection/correction. Performance Enhancements: superscalar; branching issues, multithreading, scalability, co-processors and enhancement units. Interfacing and Communications: I/O fundamentals, interrupts and interfacing, buses, protocols and arbitration. Computer Arithmetic: range, precision, real numbers, floating point and conversion, multi-precision arithmetic Multiprocessing: multiprocessing architectures and interconnections, shared memory and coherence, memory solutions Future directions: low power computing; testing, JTAG, system-on-chip and multi-core implementations, embedded systems issues, comparison of computational on CPU, DSP, FPGA and GPU."
SC3060,3,Computer Graphics and Visualisation,Foundation mathematics for computer graphics; Visual rendering pipeline; Virtual reality Modelling Language (VRML) and Extensible 3D (X3D); Geometric shapes; Transformations and motions; Visual Appearance; Rendering
SC3061,3,Human-Computer Interaction,Introduction; Usability and application spaces; Guidelines and principles for text-based interactions; Hardware devices for interaction; Development processes and assessments; Software tools in user interface development; Interaction styles; Practical UI development concepts; Design Issues
SC4030,3,WIreless & Mobile Networks,"This course builds upon the foundation network knowledge gained from core courses on Computer Networks (CE3005/CZ3006/SC2008). It aims to introduce students to the realm of mobile networks and communications made possible through wireless technologies. It provides a straightforward and broad survey of wireless voice and data network standards and technologies available today for personal communications. It is designed for those taking an entry-level wireless and mobile technology course or seeking better knowledge of wireless communications and networks. The topics include the technologies being harnessed in Bluetooth and Bluetooth Low Energy to Wifi to cellular telephony and mobile data to 5G wireless technologies to satellite internet and satellite communications. The course content thus spans wireless personal networks (WPAN), wireless local area networks (WLAN) and wireless wide area networks (WWAN)."
SC4031,3,Internet of Things: Communications and Networking,
SC4040,3,Advanced Topics in Algorithms,"This course aims to develop your ability to identify key structural components in algorithms, problems and domains alike, and to exploit them to create provably computationally efficient solutions. This course builds on basic skills obtained in the pre-requisite 'Algorithm Design and Analysis' course to provide you with intricate, elegant and actionable algorithmic design patterns; and develop your skill in exploiting salient problem features to facilitate computation. Algorithms and designs presented in this course were at the beginning of multiple disciplines that now dominate the IT industry, and serve as a stepping stone for your further development for such roles as an algorithms engineer/developer or an applied researcher in computer technologies."
SC4050,3,Parallel Computing,"The course targets equipping students with foundational knowledge and practical skills in parallel computing. It is designed for students with a keen interest in understanding and harnessing the power of parallel architectures and algorithms to solve complex computational problems. It covers theoretical underpinnings, architecture, algorithm design, programming techniques, and emerging models in the domain. The curriculum unfolds across four main segments: 1. Parallel Computation Models and Parallelism: Exploration of parallelism fundamentals and diverse computation models lays the groundwork. 2. Parallel Architectures: Investigation into various architectural designs, including shared-memory, distributed-memory, and data parallel architectures, alongside interconnection networks and communication basics. 3. Parallel Algorithm Design and Programming: Focuses on crafting and implementing efficient parallel algorithms, emphasizing performance optimization and scalability. 4. Emerging Parallel Computing Models: Introduces cutting-edge paradigms such as grid, cloud, and GPGPU computing, highlighting their significance and application. This approach aims to foster a deep understanding of parallel computing's core principles, alongside the development of competencies in parallel programming on actual parallel systems. Students will navigate through the theoretical aspects, practical implementations, and the evolving landscape of parallel computing, preparing them for advanced research or professional practice in this dynamic field."
SC4051,3,Distributed Systems,"This course introduces the concepts and design of distributed systems. 1. Foundations: characteristics of distributed systems, architectural models, fundamental models, interprocess communication. 2. Middleware: remote method invocation, remote procedure call, name services, CORBA. 3. System Infrastructure: distributed file systems, peer-to-peer systems. 4. Distributed Algorithms: clock synchronization, logical and vector clocks, distributed mutual exclusion, election algorithms, consensus algorithms, replication and fault tolerance."
SC4052,3,Cloud Computing,
SC4053,3,Blockchain Technology,"Blockchain Technology has taken the world by storm with its proliferation in an astoundingly diverse array of applications. Cryptocurrencies and a plethora of business use-cases paved the way for inclusive decentralization through innovative incentives and smart contracts. In its modern incarnation, Blockchain offers the promise of immutability, consistency, attribution, authenticity and automation of record-keeping as well as computations within an inherently decentralized operating environment. This elective course in Computer Science and Engineering aims to introduce you to the core technical framework of Blockchain Technology and Cryptocurrencies, encompassing distributed systems, consensus protocols, incentive mechanisms and decentralized applications. You will also learn the major anonymity, security, privacy, scalability and interoperability issues in modern Blockchain, in addition to the relevant enterprise platforms, solutions, applications and regulatory aspects of the technology."
SC4054,3,Simulation and Modelling,"Basic concepts: system, model, simulation. Different types of simulation: Monte Carlo simulation, continuous system simulation, discrete event simulation. Simulation software: modelling and simulation using Arena. Generating random numbers and random variables for simulation study: LCG, inverse transform, convolution. Analysis of input and output data: MLE, Goodness-of-fit test, confidence interval. Verification and validation: concepts and techniques. Queuing models: properties, performance measures and basic formulas. Comparison of alternative designs: paired-t approach, multiple comparison problem. Variance reduction: CRN, AV."
SC4060,3,Virtual and Augmented Reality,Definition of augmented and virtual reality; Human factors and sensory conflict; A generic VR system; 3D real-time computer graphics for VR systems; Physically-based simulation; Virtual reality hardware; Virtual reality software; Virtual reality applications; VRML and X3D; Shared virtual spaces. Each lecture module will be accompanied by typical examination problems and their model solutions which will be studied as hands-on experiences.
SC4242,3,Compiler Techniques,
SC1013,2,Physics For Computing,"Course Content Optics, Electrics, Electronics, and Magnetism. Learning Outcome Upon completion of the course, students should be able to: a. Explain basic knowledge of all the selected topics b. Identify the contribution of physics in some computing systems c. Realize and appreciate the interdisciplinary nature of many innovative systems d. Self-reflect whether you are more aware of the importance of Physics and more sensitive to the progress of physics, and consider to propose novel physics-computing systems"
EG1001,2,Engineers in Society,"This course aims to provide a general understanding of the society we live in and the engineers' roles and responsibilities towards society's well-being. The course is part of broadening education objective in the engineering curriculum. The course covers a wide range of topics including the history of engineering, engineering ethics and practices, sustainability, and contributions by engineers towards society in the future. The students will have a holistic understanding of the role played by engineers and on their impact in society"
SC2107,3,Microprocessor System Design and Development,"This core engineering course aims to develop your understanding of the architecture of a microprocessor system and the software development process of a microprocessor based embedded system. The course will expose you to various design and application considerations involved in developing the software and hardware. This includes power management, signal chain handling, memory interfacing and finite state machine design. All of which will be applied in the laboratory sessions using a microprocessor based robotic hardware as the platform."
SC2103,3,Digital System Design,"This course aims to develop skills in digital hardware design to meet basic industry expectations. Here, the principles established in CE1005/CZ1005/SC1005-Digital Logic will be extended to encompass circuits of greater complexity. These circuits are no longer implemented using multiple discrete logic elements, as presented in CE1005/CZ1005/SC1005, but rather use Application Specific Gate Array (ASIC) or Field Programmable Gate Array (FPGA) technologies. Both of these technologies can accommodate circuits of complexity equivalent to many millions of gates. This course will focus on FPGA technology as it is gaining commercial popularity (due to the cost of ASIC Implementations). The necessary logic and connectivity for both technologies is synthesised by software tools from code written in a Hardware Description Language. As such, this course presents you with circuit design techniques for more advanced systems in a methodical manner based on modern design techniques."
SC2104,3,"Sensors, Interfacing, & Digital Control","The course aims to teach the students the operation principles of some common digital sensors used in today's control systems design and implementation. Students will also learn the interfacing techniques used to transfer data between the sensors and controller, and how the data can be processed by using appropriate digital signal processing algorithms. Student will then learn the basic operation principles of control systems, and how digital sensors are used in such systems to implement feedback control based on digital controller."
SC3102,3,"Signals, Systems and Transforms","This course introduces the students to the basic concepts and theory behind techniques and algorithms used in signal processing systems, a topic that forms an integral part of engineering systems in many diverse areas. Emphasis is on different types of signals and systems, and their interrelation and representation using different orthogonal components. Upon completion, the student should be able to understand the fundaments of signals and linear time invariant (LTI) systems, understand and apply Fourier transforms, Laplace transforms, and Z-transform to the analysis and description of signals and LTI systems, and take advanced level courses on the systems area."
SC3103,3,Embedded Programming,"This course aims to teach you how to develop programs for OS based embedded systems that are increasingly been used in many modern embedded systems, ranging from handphones to automotive applications. In this course, you will first learn about the process of developing multitasking programs for embedded systems based on RTOS, its features and its performance metric. You will then learn the programming techniques used in Linux based systems, ranging from the use of toolchain (GCC, Makefile and Linker Script), concurrent programming techniques (IPC, multitasking and multithreading), kernel modules development and its booting process."
SC3920,10,Professional Internship (Graded),
SC4172,3,Internet of Things: Tiny Machine Learning,"In this Tiny Machine Learning (TinyML) course, students will learn the techniques to implement machine learning on resource constrained devices that are to be deployed as smart IoT devices that form the crucial end components in Edge computing. TinyML enables very low power (mW range and below) IoT device (typically a microcontroller) to perform the ML inference on the device in real time, which enable on-device data analytics and improved response time as well as reduces power consumption since the data does not need to be forward to the Cloud for further processing. After attending this course, the students will know the steps required to develop deep learning based applications running TensorFlow Lite for microcontroller. Students will also learn the techniques to optimize performance parameters such as latency, energy, and code size for the implementation of smart IoT devices."
MH1805,4,Calculus,"This course aims to equip you with the subject knowledge, logical reasoning and analytical skills so that you are able to apply the concepts and techniques of calculus of one variable to solve problems encountered in science."
MH2500,4,Probability and Introduction to Statistics,"This is a core mathematical course, aiming to develop your understanding of fundamental concepts in probability and statistics such as random variables, independence, basic probability distributions, and confidence intervals. The course also prepares you for further statistics courses such as MH3500 in the Statistics Track."
MH2802,3,Linear Algebra for Scientists,"This course aims to support you in acquiring a wider range of mathematical concepts related to vector spaces and linear algebra, while also developing a strong set of mathematical skills for upper-level Physical and Computing Science courses. Through a mathematical approach to problem-solving, you will have the opportunity to develop thinking, reasoning, communication, and modelling skills. Additionally, the course aims to help you connect ideas within mathematics and apply mathematical principles in the context of Physical and Computing Science courses. Ultimately, this course seeks to provide an experience that fosters an appreciation for the rigour and abstraction in the discipline."
SC3021,3,Data Science Fundamentals,
MH3500,4,Statistics,"This course aims to develop your understanding of the statistical concepts of parameter estimation and hypothesis testing that are fundamental for real life applications of statistics as well as for numerous further courses in the curriculum of the statistics track. Further topics in statistics, including: random samples, sample mean and sample variance, distributions derived from the normal distribution, the central lmit theorem; parameter estimation and quality criteria for parameter estimators; the construction of good estimators; method of moments and maximum likelihood method; asymptotic properties of estimators, Cramer-Rao bound and efficient estimators; confidence intervals for estimators; hypothesis testing and Fisher-type tests; Neyman-Pearson tests and Neyman-Pearson Lemma."
MH3511,3,Data Analysis with Computer,"In today's business, data analysis plays an important role in making decisions more scientific and helping the business achieve effective operation. By closely examining data we can find patterns to perceive information, and the information can be used to enhance knowledge. This course provides basic concepts for data analysis with the usage of the R programming language. You will learn the skills of plotting, summarising, making inferences, and presenting various types of data."
