courseCode,academicUnits,title,description
HE1001,3,Microeconomics I,"The Singaporean Government is increasingly engaging the public, and as economists we are responsible for contributing towards better public decisions. This is especially important as good public policy processes place value on social impact, seeks to understand the behavior of Singapore's diverse society, and makes sense and use of increasingly abundant behavioral data. As the Singaporean economy gets more advanced and complex, and citizens get better educated and informed, we rely on decisions strengthened by sound economic thinking. The economist must move towards more rigorous reasoning across the levels of household, corporate, and public choice. In this course we apply fundamental microeconomic principles complemented by behavioral economics to various current everyday concerns in Singapore. The course aims to deliver a progressive and rigorous introduction to basic concepts and models of microeconomics, applied to current trends local and global. Microeconomics is one of the three core pillars of an Economics major. This is an important module that will serve as a prerequisite for almost all major PE modules. The first part of the course covers the theory of individual decision-making in consumption, risk and labor. The second part of the course covers the theory of firms making production decisions when operating under various market structures, in particular price discrimination with market power and strategic interactions between firms. This course will also expose students to new developments in the field of microeconomics which have now come to assume a central role, in particular behavioral economics. Students will learn basic theories that can be abstract and simple but yet so relevant and powerful in explaining decision problems in our everyday lives. On the one hand, it will give students with either no previous economics training a chance to close the gap with those with a stronger background. On the other hand, it will give everyone a chance to appreciate microeconomics in action right from the start of their education at NTU - a feature that is surprisingly amiss in many Economics undergraduate programs worldwide."
HE1002,3,Macroeconomics I,"The course aims to provide first-year college students with a sound understanding on the structure and functioning of the economy as a whole. As you are taking an introductory course, you are not expected to have any prior knowledge in economics. Instead, the principles you learn from this course will provide a solid foundation and develop a strong interest for your further study of intermediate and advanced macroeconomics."
HE2001,3,Microeconomics II,"Principals of Microeconomics has introduced basic concepts in market and discussed how markets work in general. The aim of this course is to deepen the understanding of behaviors in the market by further examining the decision process of economic agents and the implied welfare consequences. In the first half of the course, we focus on how individuals make their decisions in the market by discussing two broad topics. The first is the analysis of price and income changes in the market. This discussion builds on what have already been covered in Principals of Microeconomics. The second topic is individual decision-making regarding time, risk, and uncertainty where we will also examine how the asset market works. In the second half of the course, we focus on analysing the welfare effects of outcomes in markets and society. To this end, students will learn different measures of welfare and criteria for efficiency, and how perfectly competitive markets help achieve socially optimal outcomes. Subsequently, we will discuss the problems related to making choices for society and how these may be reconciled."
HE3001,3,Microeconomics III,"In HE1001 Microeconomics I and HE2001 Microeconomics II, we have covered the core tenets of decision making by firms and individuals, and how perfect competition translates this into efficient outcomes under specific conditions. The main aim of this course is to extend our framework to contexts with less than ?perfect? settings. We will first study the basics of game theory, analysing strategic interactions between small numbers of agents and discuss its applications. Subsequently, we will study various kinds of market frictions and how they can lead to sub-optimal outcomes in the market, covering possible solutions. This will include classical ones like asymmetric information, classical externalities and common access and also newer ones like information technology. Lastly, we will also introduce behavioural economics and how social and psychological elements can be applied to traditional topics in Economics.
"
HE2002,3,Macroeconomics II,The aim of the course is to enhance your understanding of modern developments in macroeconomic theory and offer fresh perspectives on the macroeconomic challenges of today.
MH1820,3,Introduction to Statistical Theory and Methods,This course provides a good foundation in probability and statistical inference. Basic ideas and methodologies in probability and statistics which are useful for economics students are introduced. It also aims to prepare students for higher level applied and theoretical econo-metric courses.
HE2003,3,Econometrics I,"Discussions of different estimations of the econometric models, their tests and their applications. Topics include the Simple Linear Regression Model, Generalized Linear Regression Models, Dummy variable models, dynamic models and introductory time series models. For each topic, illustrative examples will be employed during the lectures and tutorials."
HE3002,3,Macroeconomics III,This course aims to provide students a broad picture on the pattern of economic growth and development both over time and across countries in the world. It also plans to equip the students with the necessary theoretical tools to understand a set of seminal works and workhorse models in the literature that attempt to understand the empirical pattern.
HE3003,3,Econometrics II,"Topics covered include misspecification analysis, maximum likelihood and instrumental variable estimation, univariate time series analysis and autoregressive distributed lag models."
SC3026,5,Professional Attachment,
BF2219,3,Investment,"This is an introductory but demanding course in investments. This course endeavours to provide the basic understanding and tools to conduct portfolio analysis, make investment decisions, and manage portfolios. By the end of this course, students should have a broad understanding of investments and portfolio management. This course covers the analysis of various investment vehicles, allocation of assets, and modern portfolio theory. Students will learn valuation, portfolio construction and evaluation techniques, and apply investment techniques using Excel. Students are expected to review Financial Management. To maximize acquisition of new knowledge, the instructors will not cover overlapping topics with Financial Management, but these topics remain examinable."
BE2602,3,"Management in Principle, Skills & Competencies","Management Principles, Skills and Competencies is a comprehensive introductory course on the management process from a manager's perspective, with particular emphasis on the skills, competencies, techniques, and knowledge needed to successfully manage an organization. This course explores the basic concepts and processes of management. You will examine the fundamental roles and processes of planning, leading, organizing, and controlling that comprise the managers' role. It focuses on the entire organization from both a short and long-term perspective for strategic vision, setting objectives, crafting a strategy, and then implementing it. This course will enable you to develop short and long-range plans to effectively accomplish organizational goals. You will develop skills related to the manager's function as required in today's competitive environment. This course examines the logic and working of organizations. It also investigates how organizations develop and maintain competitive advantage within a changing business environment influenced by political, economic, social, technological, legal and environmental [PESTLE] factors. The course content is organized around the four `pillars' of management viz. planning, organizing, leading and control [POLC] for systematic understanding of management-related challenges and applying conceptual tools and techniques in analyzing, evaluating, and addressing management issues1. This course is for undergraduate students to be equipped with fundamental management principles, its application aspects and the essential managerial skills to be a future ready business leader"
BM2509,3,Consumer Insights,"This course will introduce you to key consumer behavior concepts, thus equipping you - as current or future managers - with the knowledge to discover insights as well as to evaluate and design effective marketing decisions. After the completion of this course, you should be able to understand the psychology of how consumers think, feel, reason, and choose between different alternatives (e.g., brands, products), how social and cultural environments (e.g., friends, family, and culture) influence consumer behaviour, and how marketers can use consumer insights to develop marketing campaigns/strategies to reach their target segments. You will also learn to appreciate the relevance of consumer behaviour for marketers and policymakers.
 "
BE1402,3,Business Operations & Process,"This course seeks to provide business and accountancy undergraduates with a rigorous appreciation of the issues and methodologies necessary for ensuring the competitiveness of the operations function in a firm. The course will be taken by first year business and accountancy undergraduates. The course takes an analytics-based 'process management' viewpoint while addressing a range of strategic and tactical issues. After completing this course, you will be able to understand the key tradeoffs required for designing, managing, and improving operations and processes in both manufacturing and service industries. This will give you a sound analytical background for further courses in Business Analytics Specialization, which in turn will prepare you for a future business career where you will be responsible for either managing operations or its interface with other business functions such as marketing, finance, accounting, human resources, and information technology."
BF2226,3,Trade Incoterms & Ship Chartering,"The aim of this course is to provide students with the foundational skills needed to negotiate for ocean freight transportation. Specifically, this course provides a solid foundation on how ocean freight transportation works and identify how the intricacies behind ocean freight contract negotiations will affect the profits and losses in international commodity trading."
BF2227,3,Commodity Markets,"The course aims to give students a solid understanding of commodities markets with primary focus on agriculture, metals and minerals and energy and chemicals. It focuses on fundamental concepts and terminology necessary for understanding commodity production, transportation, economics and marketing. It also educates students in trading technology trends and innovation and look into sustainability challenges and legal aspects."
BF3214,2,Commodities Trading,"This course aims to prepare you for a career in the global commodities markets by introducing you to global commodity market conventions, supply chains, risk management and investment techniques. It will also give you an understanding of the key industry participants and their role across the commodity supply chain. You will also gain valuable insight into market conventions, terminology and best practices in risk management."
BF2302,2,International Tax & Trading Law,"BF2302 International Tax and Trading Law introduces students to key income tax and legal concepts and principles of international taxation and trade law. Particular emphasis will be placed on the international tax and legal implications of the international trading of commodities. Relevant case law, the interpretation and application of tax treaties and recent international tax developments, including the OECD's Base Erosion and Profit Shifting (BEPS) Action Plan, will also be covered in the course. The Law segment will cover legal issues of international commercial transactions."
BF3226,2,Strategic Management in Commodity Markets,"The aim of this course is to provide students with a good understanding of the important blocks of leadership, crisis management, and sustainability to be successful in commodity trading and commodity markets."
BF3212,2,"Trade, Structured & Supply Chain Finance","This course aims to complements other learning obtained in respect of commodity trading, maritime arrangements and legal aspects. Together with the afore-mentioned topics, this course fills essential learning needs for aspirants seeking entry into careers in international trading and commercial banking. You will also learn about products, concepts & practices routinely applicable to the financing of international trade transactions"
BF3213,2,Enterprise Risk Management in Commodity Markets,"All organizations (especially commodities / energy trading organizations) face a wide range of enterprise risks. This course provides: i) an overview on the range of key risks that continue to challenge these firms ii) how to assess and identify existing and emerging risks facing these firms iii) how to maintain an effective risk management framework to monitor and manage such risks iv) Overview and analysis of basic risk management techniques Managing risk has never been so complex and regulated in a commodities / energy trading organization. Everyone in an organization (trading or non-trading, client facing traders/marketers or finance/IT teams) is expected to understand and manage risk across an organization. Anyone aspiring to have a career in trading, risk management or a job in a trading organization would find value in this course."
ET5211,3,Entrepreneurial Mindset & Technology Innovation,"This course will provide the fundamental knowledge in entrepreneurship and innovation, with the special focus in training the students to develop the entrepreneurial mindset and exposing them to various technology innovation. Specific technology expertise will be brought to the classes to share their knowledge, real life experience, and industry insights. Students will be trained to ask: what are the applications of the new technology, how to use it, who will find it useful, where are the main users, who will pay for it, how to commercialize it?"
ET5213,3,Managing New Ventures,"This course aims to help the students relate theoretical concepts of strategy and organization design with practical and execution issues of manging new ventures in today's economy. Strategies for new venture development and key elements that propel scaling up as well as impede growth will be explored. You will understand the process from starting a new venture to the growth and development of the venture, as well as concepts such as entrepreneurial motivation, new venture types, competitive analysis, go-to market strategies, raising funds for start-ups, harnessing human capital, and execute operations for sustainable growth."
ET5212,3,Entrepreneurial Ecosystems,"Upon completion of this course, you will know how to recognize and evaluate new venture opportunities; will understand the issues faced by entrepreneurs when starting a venture; and will have the fundamental skills and tools required for starting and growing a new business. In addition, you will know and understand the difference between an opportunity and an idea; the value proposition and how it applies to a new venture; the need for sustainable competitive advantage; and the methods to estimate profitability of a new venture. Finally, you will be able to better assess your potential and interest in becoming an entrepreneur."
ET5214,3,Financing Entrepreneurial Ventures,"This course focuses on the special and unique considerations when planning the funding needs of new and young ventures. Many typical avenues of raising funds (such as bank borrowing, issuance of bonds or liquid equities) for established or public-listed companies are usually not available to new and young ventures due to the latter?s lack of business track records. Hence, alternative fund raising avenues for new and young ventures need to be addressed. The analyses and requirements of professional investors in new and young ventures, in particular the venture capital funds, are very different from that of the public-equity investors or fund managers. This course will enable you to learn the approach to raising funds from the professional investors, and to understand the unique requirements of the venture capital funds, so as to enhance the probability of securing funding for your venture. This course is not only relevant for would-be entrepreneurs, but will also benefit students who intend to pursue a career in the venture capital industry or in corporate venture investments."
MH1100,4,Calculus I ,"This core mathematical course aims to provide an introduction to the fundamental mathematical concepts (functions, limits, continuity, derivatives and integrals). Computation of derivatives (sum, product, and quotient formulas, chain rule, and implicit differentiation), and application of derivatives to optimization problems and related rates of change problems will also be discussed. This course lays the foundation for more advanced studies in mathematics, physics, engineering, and other related subjects. List of key topics taught 1. Functions 2. Limit and limit laws 3. Continuity 4. Derivatives and derivative function 5. Differentiation formulas 6. Trigonometric derivatives and chain rules 7. Implicit differentiation 8. Linear approximation and extreme values 9. Mean value theorem 10. Limit and infinity 11. Curve sketching 12. Optimization and Newton?s method 13. Antiderivatives
 "
MH1200,4,Linear Algebra I ,"This is a core course for mathematics students and a suitable elective for engineering students. This course provides a grounding on vectors, matrices, and solving systems of linear equations that is fundamental for future mathematics courses and also many practical applications. The course begins by introducing vectors and matrices, and basic operations on them. We then move into the fundamental topic of solving system of linear equations and learn the Gaussian elimination algorithm, an idea that pervades the entire course. In the second half of the course we revisit these ideas in a more abstract way, learning about general vector spaces, linear independence, and the fundamental subspaces associated with a matrix. These ideas are then applied to finding the least squares solution to an inconsistent system of linear equations."
MH1300,4,Foundation of Mathematics,"Introductory course on core mathematical concepts, including logic and the theory of sets. Topics include: elementary logic, mathematical statements, and quantified statements; sets, operations on sets, Cartesian products, and properties of sets; natural numbers, integers, rational numbers, real numbers, and complex numbers; relations, equivalence relations, and equivalence classes; functions, injective and surjective functions, inverse functions, and composition of functions; division algorithm, greatest common divisor, Euclidean algorithm, fundamental theorem of arithmetic, modulo arithmetic."
MH1101,4,Calculus III,"Further topics in calculus. Topics include: definite integrals; the Fundamental Theorems of Calculus; area of plane regions, volumes of solids, length of arcs; the Mean Value Theorem for integrals; techniques of integration, numerical integration, and improper integrals; monotonic and bounded sequences, Newton's method, infinite series, tests for convergence and divergence, alternating series, and absolute/conditional convergence criteria; differentiation and integration of power series, Taylor series, binomial series, and Fourier series."
MH1201,4,Linear Algebra II,"Further topics in linear algebra. Topics include: linear transformations, kernels and images; inner products, inner product spaces, orthonormal sets, and the Gram-Schmidt process; eigenvectors and eigenvalues; matrix diagonalization and its applications; symmetric and Hermitian matrices; quandratic forms and bilinear forms; Jordan normal form and other canonical forms."
MH1301,4,Discrete Mathematics,"Introduction to discrete mathematics, including: basics of counting; the inclusion-exclusion principle; the pigeonhole principle; permutations and combinations; the binomial theorem; recurrence relations and linear recurrence relations; graph concepts such as Shortest-, Euler-, Hamilton-Paths and Cycles, coloring, planarity, weighted graphs, and directed graphs."
PS0002,3,Introduction to Data Science and Artificial Intelligence,"This course aims to provide students with an understanding of basic techniques for data analysis, machine learning and dimension reduction for big data and expose them to hands-on computational tools that are fundamental for data science. Besides supervised and unsupervised learning, another fundamental technology of Artificial Intelligence - reinforcement learning will also be introduced, including Markov decision process and Q-learning. It will also show students how they could apply various methods to data examples and case studies from both research and industrial sources in the Singapore context."
MH4900,8,Final Year Project,"Semester-long research course on an advanced topic, under the supervision of a faculty member, leading to a research thesis. Must be taken over two consecutive semesters."
MH2220,3,Algebra I,This MAS course aims to introduce group theory that is essential for more advanced algebra courses and applications. The axiomatic concepts serve as a language to study concrete examples in broader sense and helps in developing logical thinking.
MH3100,4,Real Analysis,"Basic properties of real numbers, supremum and infimum, completeness axiom, open and closed sets, compact sets, countable sets. Limits and convergence of sequences, subsequences, Bolzano-Weierstrass theorem, Cauchy sequences, infinite series, double summations, products of infinite series. Limits of functions, continuity, uniform continuity, intermediate value theorem, extreme-value theorem. Differentiability, derivatives, intermediate value property, Cauchy mean value theorem, Taylor's theorem, Lagrange's form of the remainder. Sequence and series of functions, uniform convergence and differentiation. Power series, radius of convergence, local uniform convergence of power series."
MH3101,4,Complex Analysis,"Introduction to complex analysis. Topics include: analytic functions of one complex variable, the Cauchy-Riemann equations; contour integrals, Cauchy's theorem and Cauchy's integral formula, maximum modulus theorem, Liouville's theorem, fundamental theorem of algrebra, Morera's theorem; Taylor series, Laurent series, and singularities of analytic functions; the residue theorem and the calculus of residues; Fourier transforms, inversion formula, convolution, and Parseval's formula."
MH3220,4,Algebra II,This MAS course aims to introduce ring theory that is essential for more advanced algebra courses and applications. The axiomatic concepts serve as a language to study concrete examples in broader sense and helps in developing logical thinking.
MH3210,4,Number Theory,"Introduction to basic number theory, including modern applications. Topics include: modular arithmetic; the Chinese remainder theorem, Fermat's little theorem, and Wilson's theorem; number-theoretic functions such as the , , Euler's -function; the Mbius inversion formula; applications to cryptography; primitive roots and indices; Legendre's symbols; the quadratic reciprocity law; continued fractions and Pell's equations; primality tests, factorization of integers, and the RSA cryptosystem."
MH3300,4,Graph Theory,"Topics in graph theory, including: connectivity and matchings, Hall's theorem, Menger's theorem, network flows; paths and cycles, complete subgraphs and Turn's theorem, and the Erds-Stone theorem; graph colouring and the four-colour theorem; Ramsey theory; probabilistic methods in graph theory; and the use of software to solve graph-theoretic problems."
MH3320,4,Dynamical System Theory with Chaos and Fractals,"Basic concepts of determinism and randomness in the physical world. Topics include dynamical system theory, and the computational and analytical methods for studying chaotic and nonlinear systems."
MH3400,4,Algorithms for the Real World,"Applications of algorithms. Topics include: mathematical concepts for analysis of algorithms; fundamental algorithm design techniques, with applications to various problems: network algorithms, matrix algorithms, optimization algorithms, and algorithms for data analysis and machine learning; and applications to problems in combinatorial optimization, networks, operations research, data analysis and machine learning."
MH3401,3,Signal and Noise in Biology,Introduction of quantitative biology using a diverse range of phenomena related to signal and noise in biological systems as examples. Students will learn some basic yet essential mathematical techniques and discover how these tools further our understanding of biology and biophysics. 
